Product ID,Name,Price,Quantity,Category,Description,Production Date,Expiration Date,Rating,Status
105,Волгодонская,4065,676,Напитки,"Помогает поддерживать нормальный уровень гистамина, важного для иммунной системы.",2018-01-07,2025-06-05,0.05,In Stock
106,Кола,5469,845,Напитки,Помогает поддерживать нормальный уровень энергии и выносливости.,2001-02-03,2014-02-05,1.22,Cancelled
107,Щавель,602,616,Овощи,Помогает поддерживать нормальное функционирование печени и желчного пузыря.,2021-02-05,2021-06-02,2.93,Cancelled
108,Портулак,6837,9,Овощи,"Отличается высоким содержанием фтора, необходимого для здоровья зубов и костей.",2006-08-05,2022-08-18,0.04,Awaiting Review
109,Мандарин,5006,367,Фрукты,"Отличается высоким содержанием пробиотиков, улучшающих микрофлору кишечника.",2015-04-01,2024-04-01,2.97,Shipping
110,Виноград,873,592,Фрукты,Прошел тщательный отбор сырья и контроль на каждом этапе производства.,2006-09-02,2022-07-03,0.77,Awaiting Review
111,Сырокопченая колбаса,3598,290,Мясо,Помогает предотвратить развитие остеопороза благодаря высокому содержанию кальция.,1997-03-01,2023-04-13,3.94,Backorder
112,Фанта,7365,232,Напитки,"Помогает поддерживать нормальный уровень глюкагона, гормона, регулирующего уровень глюкозы в крови.",2000-03-09,2016-02-02,1.1,Returned
113,Кондиционер для волос,3415,209,Товары для дома,Отличается низким содержанием насыщенных жиров и холестерина.,2020-10-10,2023-03-21,0.75,Awaiting Payment
114,Робот-пылесос,2064,329,Товары для дома,Подходит для использования в специализированных диетах и лечебных программах.,1994-01-03,1998-01-08,2.93,Available for Pickup
115,Гвоздика молотая,1089,41,Бакалея,"Отличается высоким содержанием рутина, флавоноида, укрепляющего сосуды и улучшающего кровообращение.",2016-02-16,2028-02-02,0.94,Cancelled
116,Lipton Ice Tea,1661,253,Напитки,"Помогает поддерживать нормальный уровень генистеина, изофлавона, полезного для здоровья костей и профилактики рака.",2012-02-01,2020-01-10,3.87,New
117,Айран,4770,386,Молочные продукты,"Помогает поддерживать нормальный уровень даидзеина, изофлавона, полезного для здоровья женщин во время менопаузы.",2015-01-01,2027-06-02,4.77,Delivered
118,Sprite Zero,5405,521,Напитки,Является важным элементом спортивного питания для восстановления после тренировок.,1999-05-06,2021-01-01,3.47,New
119,Робот-пылесос,5009,539,Товары для дома,"Отличается высоким содержанием селена, важного для антиоксидантной защиты организма.",1993-02-03,1997-03-05,2.67,Backorder
120,Пакеты для детских вещей,3002,681,Товары для дома,"Подходит для людей, следящих за своим весом, благодаря низкому содержанию калорий.",2004-03-09,2011-05-01,1.91,Sold
121,Редис,3198,69,Овощи,"Отличается высоким содержанием пребиотиков, способствующих здоровью кишечника.",2010-01-01,2019-06-08,3.56,Returned
122,Фарш говяжий,5370,861,Мясо,"Помогает поддерживать нормальный уровень кортизола, гормона стресса.",2002-02-04,2014-03-13,0.96,Shipping
123,Черешня,1631,476,Фрукты,Помогает поддерживать нормальный уровень гомоцистеина в крови.,2016-02-07,2018-01-09,4.38,Out of Stock
124,Ребрышки,1205,816,Мясо,"Отличается высоким содержанием эллаговой кислоты, вещества, обладающего противораковыми свойствами.",1997-01-01,2001-01-19,4.38,Temporarily Unavailable
125,Эндивий,4676,27,Овощи,"Отличается высоким содержанием фосфора, необходимого для здоровья зубов и костей.",1996-01-18,2027-02-27,3.37,New
126,Каймак,4055,245,Молочные продукты,Помогает поддерживать нормальный обмен веществ и метаболизм.,1994-02-04,2004-01-02,3.93,Shipping
127,Освежитель воздуха,8162,512,Товары для дома,"Отличается высоким содержанием генистеина, изофлавона, полезного для здоровья костей и профилактики рака.",2021-06-02,2022-02-25,4.68,Backorder
128,Мягкие игрушки,7944,612,Товары для дома,"Помогает поддерживать нормальный уровень сапонинов, веществ, способствующих снижению уровня холестерина.",1995-06-03,1999-01-20,3.97,Backorder
129,Лимон,4213,501,Фрукты,"Не содержит консервантов и красителей, что делает его экологически чистым продуктом.",2011-07-04,2015-02-07,3.92,Backorder
130,Кухонные ножи,1619,119,Товары для дома,Помогает поддерживать нормальный уровень эстрогенов у женщин.,1996-01-05,2025-07-03,3.57,Cancelled
131,Патиссон,8005,254,Овощи,Прошел проверку на соответствие экологическим нормам и стандартам.,2005-03-04,2024-09-04,2.75,Pending
132,Фета,2225,537,Молочные продукты,Помогает поддерживать нормальную функцию щитовидной железы благодаря содержанию йода.,2008-01-26,2029-01-23,1.34,Temporarily Unavailable
133,Чеддер,4878,321,Молочные продукты,Прошел клинические испытания и рекомендован специалистами в области здравоохранения.,2002-01-10,2030-05-06,4.28,Available for Pickup
134,Брынза,3285,674,Молочные продукты,"Отличается высоким содержанием генистеина, изофлавона, полезного для здоровья костей и профилактики рака.",2014-11-04,2017-05-24,0.03,In Stock
